{
  "schemaVersion": "1.0.0",
  "name": "ICTC Advanced UX Layer",
  "claimClass": "bounded-ux-engineering-attestation",
  "claim": "Layer UI/UX derivato dalla SOT, accessibile ed ergonomico nello scope testato; non costituisce certificazione WCAG o validazione con utenti reali.",
  "layers": [
    {"id":"observe","label":"Osserva","purpose":"Comprimere fonti e differenze osservate senza determinare materialità."},
    {"id":"decide","label":"Decidi","purpose":"Rendere visibili le scelte umane aperte senza inferire urgenza o conformità."},
    {"id":"act","label":"Agisci","purpose":"Rendere visibili responsabilità, transizioni e mapping senza inferire efficacia."},
    {"id":"verify","label":"Verifica","purpose":"Rendere visibili integrità, eventi e tracce senza inferire verità sostanziale."}
  ],
  "accessibility": {
    "orientation": ["WCAG 2.2 AA", "WAI-ARIA APG"],
    "targetSizeCssPixels": 44,
    "preferences": ["text", "density", "contrast", "motion"],
    "keyboard": ["Tab", "ArrowLeft", "ArrowRight", "Home", "End", "Alt+U"],
    "adaptations": ["reflow", "forced-colors", "reduced-motion", "visible-focus", "live-region"]
  },
  "definitionOfDone": [
    {"id":"UX-DOD-001","criterion":"Quattro proiezioni deterministiche con contratto completo","required":true},
    {"id":"UX-DOD-002","criterion":"Nessuna assenza o failure rappresentata come stato positivo","required":true},
    {"id":"UX-DOD-003","criterion":"Una sola proiezione espansa alla volta","required":true},
    {"id":"UX-DOD-004","criterion":"Tablist con roving tabindex e frecce/Home/End","required":true},
    {"id":"UX-DOD-005","criterion":"Target interattivi almeno 44x44 CSS px","required":true},
    {"id":"UX-DOD-006","criterion":"Testo, densità, contrasto e movimento adattabili localmente","required":true},
    {"id":"UX-DOD-007","criterion":"Forced colors e reduced motion supportati","required":true},
    {"id":"UX-DOD-008","criterion":"18 journey e 7 modalità d'uso simulate","required":true},
    {"id":"UX-DOD-009","criterion":"Quattro stati degradati verificati","required":true},
    {"id":"UX-DOD-010","criterion":"Saturazione M=48 e M+100=148 senza novelty dopo M","required":true},
    {"id":"UX-DOD-011","criterion":"Screenshot browser con hash e asserzioni DOM","required":true},
    {"id":"UX-DOD-012","criterion":"Nessun nuovo claim di conformità, rischio o completezza","required":true}
  ],
  "metrics": [
    {"id":"UX-MET-001","name":"projectionContractCompleteness","target":1,"unit":"ratio"},
    {"id":"UX-MET-002","name":"journeyCoverage","target":1,"unit":"ratio"},
    {"id":"UX-MET-003","name":"namedStatusRate","target":1,"unit":"ratio"},
    {"id":"UX-MET-004","name":"explicitLimitationRate","target":1,"unit":"ratio"},
    {"id":"UX-MET-005","name":"maximumSimultaneousStages","target":4,"unit":"count"},
    {"id":"UX-MET-006","name":"primaryActionPerExpandedStage","target":1,"unit":"count"},
    {"id":"UX-MET-007","name":"targetSizeMinimum","target":44,"unit":"css-px"},
    {"id":"UX-MET-008","name":"inputModalitiesCovered","target":7,"unit":"count"},
    {"id":"UX-MET-009","name":"degradedStatesCovered","target":4,"unit":"count"},
    {"id":"UX-MET-010","name":"noveltyAfterM","target":0,"unit":"count"}
  ],
  "saturation": {
    "M": 48,
    "MPlus100": 148,
    "primitiveCount": 14,
    "noveltyAfterM": 0
  },
  "limitations": [
    "Gli audit automatici non certificano conformità WCAG.",
    "La contract preview locale non equivale allo screenshot del runtime reale.",
    "Restano necessari test manuali con screen reader, high contrast e utenti reali.",
    "Il Projection Stack non modifica SOT, ledger, priorità o autorità degli oggetti."
  ]
}
